"Key","Item Type","Publication Year","Author","Title","Publication Title","ISBN","ISSN","DOI","Url","Abstract Note","Date","Date Added","Date Modified","Access Date","Pages","Num Pages","Issue","Volume","Number Of Volumes","Journal Abbreviation","Short Title","Series","Series Number","Series Text","Series Title","Publisher","Place","Language","Rights","Type","Archive","Archive Location","Library Catalog","Call Number","Extra","Notes","File Attachments","Link Attachments","Manual Tags","Automatic Tags","Editor","Series Editor","Translator","Contributor","Attorney Agent","Book Author","Cast Member","Commenter","Composer","Cosponsor","Counsel","Interviewer","Producer","Recipient","Reviewed Author","Scriptwriter","Words By","Guest","Number","Edition","Running Time","Scale","Medium","Artwork Size","Filing Date","Application Number","Assignee","Issuing Authority","Country","Meeting Name","Conference Name","Court","References","Reporter","Legal Status","Priority Numbers","Programming Language","Version","System","Code","Code Number","Section","Session","Committee","History","Legislative Body"
"TL5K9FUQ","journalArticle","2012","Gresham-Lancaster, Scot; Sinclair, Peter","Sonification and Acoustic Environments","Leonardo Music Journal","","0961-1215","","https://www.jstor.org/stable/23343813","Sonification can allow us to connect sound and/or music via data to the environment; in another sense, by ""displaying"" data through sound, sonification participates in creating our acoustic environment. The authors consider here the significance of certain aspects of this relationship.","2012","2023-07-10 06:56:35","2023-07-10 06:56:35","2023-07-10 06:56:26","67-71","","","22","","","","","","","","","","","","","","","JSTOR","","Publisher: The MIT Press","","","","","","","","","","","","","","","","","","","","","","","","","","","","","","","","","","","","","","","","","","","","","","","","","","",""
"W87PXDQV","journalArticle","2006","Barrass, Stephen; Whitelaw, Mitchell; Bailes, Freya","Listening to the Mind Listening: An Analysis of Sonification Reviews, Designs and Correspondences","Leonardo Music Journal","","0961-1215","","https://www.jstor.org/stable/4540588","Listening to the Mind Listening (LML) explored whether sonifications can be more than just ""noise"" in terms of perceived information and musical experience. The project generated an unprecedented body of 27 multichannel sonifications of the same dataset by 38 composers. The design of each sonification was explicitly documented, and there are 88 analytical reviews of the works. The public concert presenting 10 of these sonifications at the Sydney Opera House Studio drew a capacity audience. This paper presents an analysis of the reviews, the designs and the correspondences between timelines of these works.","2006","2023-07-10 06:56:35","2023-07-10 06:56:35","2023-07-10 06:56:28","13-19","","","16","","","Listening to the Mind Listening","","","","","","","","","","","","JSTOR","","Publisher: The MIT Press","","","","","","","","","","","","","","","","","","","","","","","","","","","","","","","","","","","","","","","","","","","","","","","","","","",""
"TN45I58W","journalArticle","2012","Burraston, David","Environmental Sonification of Rainfall with Long Wire Instruments","Leonardo Music Journal","","0961-1215","","https://www.jstor.org/stable/23343797","Environmental sonification of rainfall events using large-scale long wire instruments is presented. After a brief historical introduction of long wires and their relationship to the Aeolian harp, some aspects of construction and recording techniques are discussed. Observations of rainfall-induced vibrations on long wire audio recordings are then presented.","2012","2023-07-10 06:56:35","2023-07-10 06:56:35","2023-07-10 06:56:29","11-14","","","22","","","","","","","","","","","","","","","JSTOR","","Publisher: The MIT Press","","","","","","","","","","","","","","","","","","","","","","","","","","","","","","","","","","","","","","","","","","","","","","","","","","",""
"856PL3AR","journalArticle","2006","Weinberg, Gil; Thatcher, Travis","Interactive Sonification: Aesthetics, Functionality and Performance","Leonardo Music Journal","","0961-1215","","https://www.jstor.org/stable/4540587","The authors present a sonification installation that allows a group of players to interact with an auditory display of neural activity. The system is designed to represent electrical spike propagation in a neuron culture through sound propagation in space. Participants can simulate neural spikes by using a set of specially designed controllers, experimenting and sonically investigating the electrical activity of the brain. The article discusses some aesthetic and functional aspects of sonification and describes the authors' approach for group interaction with auditory displays. It concludes with the description of a performance piece for the system and ideas for improvements and future work.","2006","2023-07-10 06:56:35","2023-07-10 06:56:35","2023-07-10 06:56:29","9-12","","","16","","","Interactive Sonification","","","","","","","","","","","","JSTOR","","Publisher: The MIT Press","","","","","","","","","","","","","","","","","","","","","","","","","","","","","","","","","","","","","","","","","","","","","","","","","","",""
"6BGIG3C3","journalArticle","2014","Han, Yoon Chung; Han, Byeong-jun","Skin Pattern Sonification as a New Timbral Expression","Leonardo Music Journal","","0961-1215","","https://www.jstor.org/stable/43832704","The authors discuss two sonification projects that transform fingerprint and skin patterns into audio: (1) Digiti Sonus, an interactive installation performing fingerprint sonification and visualization and (2) skin pattern sonification, which converts pore networks into sound. The projects include novel techniques for representing user-intended fingerprint expression and skin pattern selection as audio parameters.","2014","2023-07-10 06:56:35","2023-07-10 06:56:35","2023-07-10 06:56:29","41-43","","","24","","","","","","","","","","","","","","","JSTOR","","Publisher: The MIT Press","","","","","","","","","","","","","","","","","","","","","","","","","","","","","","","","","","","","","","","","","","","","","","","","","","",""
"WAP4ZIYG","journalArticle","2014","Akiyama, Mitchell","Dataffect: Numerical Epistemology and the Art of Data Sonification","Leonardo Music Journal","","0961-1215","","https://www.jstor.org/stable/43832697","This article examines the history of sonification in sound art, focusing on the role that data play in influencing artistic creation and aesthetic experience. The author discusses sonified data artworks that go beyond the simple representation of information and that offer critiques of what Horkheimer and Adorno described as the dehumanizing notion of equivalence at the heart of the bureaucratic, capitalist economy. Concluding with a discussion of his installation Seismology as Metaphor for Empathy (2012), the author suggests that representing data through sound can engender powerful affective responses to the cold abstraction of information.","2014","2023-07-10 06:56:35","2023-07-10 06:56:35","2023-07-10 06:56:30","29-32","","","24","","","Dataffect","","","","","","","","","","","","JSTOR","","Publisher: The MIT Press","","","","","","","","","","","","","","","","","","","","","","","","","","","","","","","","","","","","","","","","","","","","","","","","","","",""
"WSDTJUMT","journalArticle","2013","Grond, Florian; Olmos, Adriana; Cooperstock, Jeremy R.","Making Sculptures Audible through Participatory Sound Design","Leonardo Music Journal","","0961-1215","","https://www.jstor.org/stable/43832491","A research group explores rendering sculptural forms as sound using echolocation and the participation of members of the visually impaired community.","2013","2023-07-10 06:56:35","2023-07-10 06:56:35","2023-07-10 06:56:31","12-13","","","23","","","","","","","","","","","","","","","JSTOR","","Publisher: The MIT Press","","","","","","","","","","","","","","","","","","","","","","","","","","","","","","","","","","","","","","","","","","","","","","","","","","",""
"S3QZ33FE","journalArticle","2011","Diaz-Jerez, Gustavo","Composing with Melomics: Delving into the Computational World for Musical Inspiration","Leonardo Music Journal","","0961-1215","","https://www.jstor.org/stable/41416815","The author describes his work with the Melomics approach to music composition. Taking the melody as its main object of study, Melomics, mimicking biology, implements a simulated evolution of music composition using generative methods. The goal of this work is to model the full process of professional music composition using sophisticated strategies for algorithm design.","2011","2023-07-10 06:56:35","2023-07-10 06:56:35","2023-07-10 06:56:32","13-14","","","21","","","Composing with Melomics","","","","","","","","","","","","JSTOR","","Publisher: The MIT Press","","","","","","","","","","","","","","","","","","","","","","","","","","","","","","","","","","","","","","","","","","","","","","","","","","",""
"6YLBXWDH","journalArticle","2003","Barbosa, Álvaro","Displaced Soundscapes: A Survey of Network Systems for Music and Sonic Art Creation","Leonardo Music Journal","","0961-1215","","https://www.jstor.org/stable/1513450","The introduction of various collaborative tools, made possible by the expansion of computer network systems and communications technology, has led to new methods of musical composition and improvisation. The author describes a number of recent music and sound art projects involving the use of network systems that enable geographically displaced creators to collaboratively generate shared soundscapes. Various system designs, ideas and concepts associated with this interaction paradigm are presented and classified by the author.","2003","2023-07-10 06:56:35","2023-07-10 06:56:35","2023-07-10 06:56:32","53-59","","","13","","","Displaced Soundscapes","","","","","","","","","","","","JSTOR","","Publisher: The MIT Press","","","","","","","","","","","","","","","","","","","","","","","","","","","","","","","","","","","","","","","","","","","","","","","","","","",""
"DKAHBZHV","journalArticle","2011","de Quay, Yago; Skogstad, Ståle; Jensenius, Alexander","""Dance Jockey"": Performing Electronic Music by Dancing","Leonardo Music Journal","","0961-1215","","https://www.jstor.org/stable/41416814","The authors present an experimental musical performance called Dance Jockey, wherein sounds are controlled by sensors on the dancer's body.These sensors manipulate music in real time by acquiring data about body actions and transmitting the information to a control unit that makes decisions and gives instructions to audio software. The system triggers a broad range of music events and maps them to sound effects and musical parameters such as pitch, loudness and rhythm.","2011","2023-07-10 06:56:35","2023-07-10 06:56:35","2023-07-10 06:56:33","11-12","","","21","","","""Dance Jockey""","","","","","","","","","","","","JSTOR","","Publisher: The MIT Press","","","","","","","","","","","","","","","","","","","","","","","","","","","","","","","","","","","","","","","","","","","","","","","","","","",""
"XDRZNRYJ","journalArticle","2017","Gagen, J. M.; Wilson, A. J.","AUROSION: Eroding Sonic Landscapes with the Internet Audio Cyclotron","Leonardo Music Journal","","0961-1215","","https://www.jstor.org/stable/26779250","The authors describe Aurosion, a performance piece utilizing “the largest feedback loop in the world,” the Internet Audio Cyclotron. Using field recordings, they subvert compression algorithms to explore emergent devolution.","2017","2023-07-10 06:56:35","2023-07-10 06:56:35","2023-07-10 06:56:33","50-51","","","27","","","AUROSION","","","","","","","","","","","","JSTOR","","Publisher: The MIT Press","","","","","","","","","","","","","","","","","","","","","","","","","","","","","","","","","","","","","","","","","","","","","","","","","","",""
"I2YZY2D4","journalArticle","2009","Stearns, Phillip","Artificial Analog Neural Network: Conceptual and Technical Considerations","Leonardo Music Journal","","0961-1215","","https://www.jstor.org/stable/40926344","How is our notion of sound art shaped by the current technological landscape, and what is the role of science and technology in the pursuit of new multidisciplinary works? The author meditates on the topics of sound art, sonification, interactivity and network sciences in order to contextualize the Artificial Analog Neural Network (AANN) project.","2009","2023-07-10 06:56:35","2023-07-10 06:56:35","2023-07-10 06:56:33","14-21","","","19","","","Artificial Analog Neural Network","","","","","","","","","","","","JSTOR","","Publisher: The MIT Press","","","","","","","","","","","","","","","","","","","","","","","","","","","","","","","","","","","","","","","","","","","","","","","","","","",""
"RGTAR2SV","journalArticle","2017","Graham, Richard","ENVIRONMENTAL HISTORIES AND PERSONAL MEMORY: Collaborative Works in Sonification and Virtual Reality","Leonardo Music Journal","","0961-1215","","https://www.jstor.org/stable/26779251","This short paper will present an overview of two historical data projects developed at the Sensory Computation/Experimental Narrative Environments Lab at Stevens Institute of Technology between 2015–2017. The first project focuses on the sonification of environmental data derived from a ubiquitous sensing network embedded in Tidmarsh Living Observatory in Plymouth, Massachusetts. The second project presented in this short paper explores a history of instrument gesture data as a basis for interactivity in a virtual scene. This short statement discusses these two projects and their creative implications.","2017","2023-07-10 06:56:35","2023-07-10 06:56:35","2023-07-10 06:56:33","51-53","","","27","","","ENVIRONMENTAL HISTORIES AND PERSONAL MEMORY","","","","","","","","","","","","JSTOR","","Publisher: The MIT Press","","","","","","","","","","","","","","","","","","","","","","","","","","","","","","","","","","","","","","","","","","","","","","","","","","",""
"QKSIRUWP","journalArticle","2014","Hermans, Phillip","Convergent Technologies, Custom Aesthetics","Leonardo Music Journal","","0961-1215","","https://www.jstor.org/stable/43832716","The author anticipates how technological advances in the 21st century will give musicians the tools to further control their craft while giving listeners the ability to personalize and share their aesthetic experience.","2014","2023-07-10 06:56:35","2023-07-10 06:56:35","2023-07-10 06:56:34","74-75","","","24","","","","","","","","","","","","","","","JSTOR","","Publisher: The MIT Press","","","","","","","","","","","","","","","","","","","","","","","","","","","","","","","","","","","","","","","","","","","","","","","","","","",""
"4BH7FYGJ","journalArticle","2014","Erickson, Kristin Grace","Synthesizing Performance","Leonardo Music Journal","","0961-1215","","https://www.jstor.org/stable/43832714","The author describes synthesizing performance from abstract processes, her exploration of the computational potential of performing algorithms and her development of audio technologies to communicate real-time instructions to performers in her work M.T.Brain (2012).","2014","2023-07-10 06:56:35","2023-07-10 06:56:35","2023-07-10 06:56:34","71-73","","","24","","","","","","","","","","","","","","","JSTOR","","Publisher: The MIT Press","","","","","","","","","","","","","","","","","","","","","","","","","","","","","","","","","","","","","","","","","","","","","","","","","","",""
"FR74YRCL","journalArticle","2013","Johnson, Chuck","World on a Wire: Sound as Sensual Objects","Leonardo Music Journal","","0961-1215","","https://www.jstor.org/stable/43832510","In the mid-20th century a new conceptual paradigm rose to prominence in the sciences that captured the imaginations of the burgeoning counterculture and its most forward-thinking artists. Against the backdrop of the Cold War, a branch of systems theory called cybernetics was presented as a way to understand complex systems. Cybernetic thought has continued to exert a hegemonic, if unintended, influence in the field of experimental and technologydriven arts. The author argues that the idealistic and technoutopian character of cybernetic thought, including the holistic view of emergence, does not serve us in grave political and ecological times and suggests new ways to understand emergence in sound art that are free of the ideological baggage of cybernetic thought.","2013","2023-07-10 06:57:16","2023-07-10 06:57:16","2023-07-10 06:57:11","75-77","","","23","","","World on a Wire","","","","","","","","","","","","JSTOR","","Publisher: The MIT Press","","/Users/minsik/Zotero/storage/ZCZEJQ7I/Johnson - 2013 - World on a Wire Sound as Sensual Objects.pdf","","","","","","","","","","","","","","","","","","","","","","","","","","","","","","","","","","","","","","","","","","","","","","","","",""
"3RNHVFNV","journalArticle","1996","Linz, Rainer","Towards the Design of a Real-Time Interactive Performance Sound System","Leonardo Music Journal","","0961-1215","10.2307/1513329","https://www.jstor.org/stable/1513329","The author discusses a realtime interactive sound system designed for the performance artist Stelarc. The sound system creates sound intrinsic to the body's movement in space and is intended to augment Stelarc's software-driven muscle-stimulator system, which allows direct control of his body movement. A description of system-hardware requirements and general design principles, an overview of sensors and transducers, and a discussion of software requirements, control routines and sound design principles are included.","1996","2023-07-10 06:57:16","2023-07-10 06:57:16","2023-07-10 06:57:13","99-107","","","6","","","","","","","","","","","","","","","JSTOR","","Publisher: The MIT Press","","","","","","","","","","","","","","","","","","","","","","","","","","","","","","","","","","","","","","","","","","","","","","","","","","",""
"KYURCCEV","journalArticle","2012","Edelstein, Phil","Sonic Objects, Resonance and Chaotics","Leonardo Music Journal","","0961-1215","","https://www.jstor.org/stable/23343805","The author describes structural elements for and the conditions and contexts within which he creates his work. The recurring use of fractals and resonance is integral to the construction of sound objects.","2012","2023-07-10 06:57:16","2023-07-10 06:57:16","2023-07-10 06:57:14","54-54","","","22","","","","","","","","","","","","","","","JSTOR","","Publisher: The MIT Press","","","","","","","","","","","","","","","","","","","","","","","","","","","","","","","","","","","","","","","","","","","","","","","","","","",""
"TWIS9DZZ","journalArticle","2006","Jones, Stuart","Space-Dis-Place: How Sound and Interactivity Can Reconfigure Our Apprehension of Space","Leonardo Music Journal","","0961-1215","","https://www.jstor.org/stable/4540589","The author examines the plasticity of the perceptual spaces generated by sound and interactivity and how their dynamic relationships to other perceptual spaces, both mediated and physical, affect our overall perception of the space we are in. He does this by analyzing some of his own work, in the wider context of architecture and time-based art and design, referencing work by other makers.","2006","2023-07-10 06:57:16","2023-07-10 06:57:16","2023-07-10 06:57:14","20-27","","","16","","","Space-Dis-Place","","","","","","","","","","","","JSTOR","","Publisher: The MIT Press","","","","","","","","","","","","","","","","","","","","","","","","","","","","","","","","","","","","","","","","","","","","","","","","","","",""
"9SARKPCX","journalArticle","1996","Leonard, Neil","A Personal Approach to Contemporary Jazz: Works for Saxophone and Computer-Controlled Electronics","Leonardo Music Journal","","0961-1215","10.2307/1513299","https://www.jstor.org/stable/1513299","Jazz is often at its best when stretched to incorporate elements that might at first seem foreign or even suspect. It is now clear that computers, critical doubts notwithstanding, provide an important way to extend jazz improvisation and compositional resources. This article discusses how the author's roots in the jazz tradition inform his work using saxophone and computer-controlled electronics. He examines two such works, which draw on diverse traditions and make use of computers to allow jazz to speak in new and different tongues.","1996","2023-07-10 06:57:16","2023-07-10 06:57:16","2023-07-10 06:57:15","15-20","","","6","","","A Personal Approach to Contemporary Jazz","","","","","","","","","","","","JSTOR","","Publisher: The MIT Press","","","","","","","","","","","","","","","","","","","","","","","","","","","","","","","","","","","","","","","","","","","","","","","","","","",""
"KEEG266L","journalArticle","2017","Gresham-Lancaster, Scot","A Personal Reminiscence on the Roots of Computer Network Music","Leonardo Music Journal","","0961-1215","","https://www.jstor.org/stable/26779260","This historical reminiscence details the evolution of a type of electronic music called “computer network music.” Early computer network music had a heterogeneous quality, with independent composers forming a collective; over time, it has transitioned into the more autonomous form of university-centered “laptop orchestra.” This transition points to a fundamental shift in the cultural contexts in which this artistic practice was and is embedded: The early work derived from the post-hippie, neo-punk anarchism of cooperatives whose members dreamed that machines would enable a kind of utopia. The latter is a direct outgrowth of the potential inherent in what networks actually are and of a sense of social cohesion based on uniformity and standardization. The discovery that this style of computer music-making can be effectively used as a curricular tool has also deeply affected the evolution and approaches of many in the field.","2017","2023-07-10 06:57:16","2023-07-10 06:57:16","2023-07-10 06:57:16","71-77","","","27","","","","","","","","","","","","","","","JSTOR","","Publisher: The MIT Press","","","","","","","","","","","","","","","","","","","","","","","","","","","","","","","","","","","","","","","","","","","","","","","","","","",""
"THVKMUKE","journalArticle","1997","Thibault, Bill; Gresham-Lancaster, Scot","Experiences in Digital Terrain: Using Digital Elevation Models for Music and Interactive Multimedia","Leonardo Music Journal","","0961-1215","10.2307/1513240","https://www.jstor.org/stable/1513240","The authors have investigated the use of data that describes actual geographical terrain for purposes of deriving music and animation in interactive multimedia applications. Their approach has been to create virtual ""travelers""-automatic processes that move through the modeled terrain and respond to what they find on the basis of programmed rules of behavior. The authors discuss several implementations of the concept and outline directions they are exploring for further development.","1997","2023-07-10 06:58:10","2023-07-10 06:58:10","2023-07-10 06:58:08","11-15","","","7","","","Experiences in Digital Terrain","","","","","","","","","","","","JSTOR","","Publisher: The MIT Press","","/Users/minsik/Zotero/storage/JUR2DV64/Thibault and Gresham-Lancaster - 1997 - Experiences in Digital Terrain Using Digital Elev.pdf","","","","","","","","","","","","","","","","","","","","","","","","","","","","","","","","","","","","","","","","","","","","","","","","",""
"RBXPDF3N","journalArticle","2008","Stockholm, Jack","""Eavesdropping"": Network Mediated Performance in Social Space","Leonardo Music Journal","","0961-1215","","https://www.jstor.org/stable/25578122","The author describes an Internet-based audio composition and diffusion system, ""Eavesdropping"" (2007-2008), designed for public spaces where several computer users are gathered, such as cafés. Compositions are created from abstract mood objects rather than musical structures. A composer uploads a set of audio files to represent the different moods in the composition. During a performance, a server-based Conductor selects audio files from this set to be played at each participant's laptop based on the composition, the number of participants in the room and the time they joined the performance. This project aims to enhance awareness of and connectedness among individual members of an audience at a generative musical performance by encouraging shared experiences.","2008","2023-07-10 06:58:10","2023-07-10 06:58:10","2023-07-10 06:58:08","55-58","","","18","","","""Eavesdropping""","","","","","","","","","","","","JSTOR","","Publisher: The MIT Press","","/Users/minsik/Zotero/storage/CTAJL2XL/Stockholm - 2008 - Eavesdropping Network Mediated Performance in S.pdf","","","","","","","","","","","","","","","","","","","","","","","","","","","","","","","","","","","","","","","","","","","","","","","","",""
