"A8QXX2MT","journalArticle","2016","Deluca, Erik","Wolf Listeners: An Introduction to the Acoustemological Politics and Poetics of Isle Royale National Park","Leonardo Music Journal","","0961-1215","","https://www.jstor.org/stable/26779227","Listening to wolf howls as both material object and socially constructed metaphor highlights the contested relationship between nature and culture. The author conducted field research on Isle Royale National Park from 2011 to 2015, from which data he offers a narrative wherein citizen-scientists who listen for the howl literally “lend their ears” to a wolf biologist who has led the longest continuous predator-prey study in the world. The theoretical framework of this essay extends acoustic ecology, first theorized by R. Murray Schafer, to include environmental history and cultural theory, which problematizes definitions of “nature” and “natural.” Ultimately, this introduction describes a nuanced form of participatory, situational environmental music that plays out in the everyday lives of those listening on this remote, roadless island on Lake Superior.","2016","2023-07-10 06:58:10","2023-07-10 06:58:10","2023-07-10 06:58:09","87-91","","","26","","","Wolf Listeners","","","","","","","","","","","","JSTOR","","Publisher: The MIT Press","","","","","","","","","","","","","","","","","","","","","","","","","","","","","","","","","","","","","","","","","","","","","","","","","","",""
"PGLXKM3I","journalArticle","2016","Kant, David","The Happy Valley Band: Creative (mis)transcription","Leonardo Music Journal","","0961-1215","","https://www.jstor.org/stable/26779223","In the author’s work as a composer, he explores how state-of-the-art digital sound analysis can change how we listen to music. The Happy Valley Band (HVB) is a product of this exploration and encompasses a repertoire of microtonal deconstructions of pop songs, an open-source software suite and a dedicated performing ensemble. This article documents the author’s experience and artistic practice within this project—a process of translation between digital analysis, human listening and written notation, in which a machine-learning algorithm is trained to hear pop songs and the results of the machine-learning process are transcribed into musical notation and performed by instrumentalists.","2016","2023-07-10 06:58:10","2023-07-10 06:58:10","2023-07-10 06:58:10","76-78","","","26","","","The Happy Valley Band","","","","","","","","","","","","JSTOR","","Publisher: The MIT Press","","","","","","","","","","","","","","","","","","","","","","","","","","","","","","","","","","","","","","","","","","","","","","","","","","",""
"LWP9SLSR","journalArticle","2017","Taylor, Sean; Fernström, Mikael","Acouscenic Listening and Creative Soundwalks: Evoking Memory and Narratives through Soundscape Exploration","Leonardo Music Journal","","0961-1215","","https://www.jstor.org/stable/26779237","Sound art is at the vanguard of contemporary creative practices seeking to establish a platform for meaningful debate on a range of accelerating global environmental crises. This paper explores how the Softday art/science collaboration moved from exploring histories of the natural world in the epoch of the Anthropocene, while engaging in a continuum of public and politicized contestations addressing climate change issues, to a participatory sound art practice that that we call Acouscenic Listening and Creative Soundwalks, which may help to develop a novel frame of understanding of the world.","2017","2023-07-10 06:58:10","2023-07-10 06:58:10","2023-07-10 06:58:10","3-6","","","27","","","Acouscenic Listening and Creative Soundwalks","","","","","","","","","","","","JSTOR","","Publisher: The MIT Press","","","","","","","","","","","","","","","","","","","","","","","","","","","","","","","","","","","","","","","","","","","","","","","","","","",""
"7BWELW9P","journalArticle","2016","Day, Julian","From You to Me and Back Again: Interdependent Listening and the Relational Aesthetics of Sound","Leonardo Music Journal","","0961-1215","","https://www.jstor.org/stable/26779222","This article outlines a mode of contemporary performance based on “interdependent listening.” Interdependent listening involves creating performative feedback loops in which players respond directly to the sounds they hear others make. Most ensembles deploy such listening to some extent; however, the distinction between general ensemble playing and interdependent listening is structural, describing situations in which the interdependence generates the content. This socially driven approach can be observed historically in works by Christian Wolff, Cornelius Cardew and Pauline Oliveros and underpins recent works by the author of this article, particularly within the project Super Critical Mass. In Super Critical Mass events, temporary communities use homogeneous sound sources to create works whose structures evolve from the performers’ interconnections.","2016","2023-07-10 06:58:10","2023-07-10 06:58:10","2023-07-10 06:58:10","74-76","","","26","","","From You to Me and Back Again","","","","","","","","","","","","JSTOR","","Publisher: The MIT Press","","","","","","","","","","","","","","","","","","","","","","","","","","","","","","","","","","","","","","","","","","","","","","","","","","",""
"KDBRX2PW","journalArticle","2005","Sturm, Bob L.","Pulse of an Ocean: Sonification of Ocean Buoy Data","Leonardo","","0024-094X","","https://www.jstor.org/stable/1577794","The author presents his work in sonifying ocean buoy data for scientific, pedagogical and compositional purposes. Mapping the spectral buoy data to audible frequencies creates interesting and illuminating sonifications of ocean wave dynamics. Several phenomena can be heard, including both those visible and those invisible in graphical representations of the data. The author has worked extensively with this data to compose music and to produce ""Music from the Ocean,"" a multimedia CD-ROM demonstrating the data, the phenomena and the sonification. After a brief introduction to physical oceanography, many examples are presented and a composition and installation created from the sonifications are discussed.","2005","2023-07-10 07:05:16","2023-07-10 07:05:16","2023-07-10 07:05:03","143-149","","2","38","","","Pulse of an Ocean","","","","","","","","","","","","JSTOR","","Publisher: The MIT Press","","/Users/minsik/Zotero/storage/HCRGK9JD/Sturm - 2005 - Pulse of an Ocean Sonification of Ocean Buoy Data.pdf","","","","","","","","","","","","","","","","","","","","","","","","","","","","","","","","","","","","","","","","","","","","","","","","",""
"K6DDRUAU","journalArticle","2004","Ben-Tal, Oded; Berger, Jonathan","Creative Aspects of Sonification","Leonardo","","0024-094X","","https://www.jstor.org/stable/1577727","A goal of sonification research is the intuitive audio representation of complex, multidimensional data. The authors present two facets of this research that may provide insight into the creative process. First, they discuss aspects of categorical perception in nonverbal auditory scene analysis and propose that these characteristics are simplified models of creative engagement with sound. Second, they describe the use of sonified data in musical compositions by each of the authors and observe aspects of the creative process in the purely aesthetic use of sonified statistical data.","2004","2023-07-10 07:05:16","2023-07-10 07:05:16","2023-07-10 07:05:03","229-232","","3","37","","","","","","","","","","","","","","","JSTOR","","Publisher: [Leonardo, The MIT Press]","","/Users/minsik/Zotero/storage/HMVQYLD4/Ben-Tal and Berger - 2004 - Creative Aspects of Sonification.pdf","","","","","","","","","","","","","","","","","","","","","","","","","","","","","","","","","","","","","","","","","","","","","","","","",""
"992DR5TY","journalArticle","1999","Dunn, John; Clark, Mary Anne","""Life Music"": The Sonification of Proteins","Leonardo","","0024-094X","","https://www.jstor.org/stable/1576622","An artist and a biologist have collaborated on the sonification of protein data to produce the audio compact disc ""Life Music."" Here they describe the process by which this collaboration merges scientific knowledge and artistic expression to produce soundscapes from the basic building blocks of life. The soundscapes may be encountered as aesthetic experiences, as scientific inquiries or as both. The authors describe the rationale both for the artistic use of science and for the scientific use of art from the separate viewpoints of artist and scientist.","1999","2023-07-10 07:05:16","2023-07-10 07:05:16","2023-07-10 07:05:05","25-32","","1","32","","","""Life Music""","","","","","","","","","","","","JSTOR","","Publisher: The MIT Press","","/Users/minsik/Zotero/storage/STW2G5SX/Dunn and Clark - 1999 - Life Music The Sonification of Proteins.pdf","","","","","","","","","","","","","","","","","","","","","","","","","","","","","","","","","","","","","","","","","","","","","","","","",""
"SIJEVM6P","journalArticle","2012","Burraston, Dave","Rainwire: Environmental Sonification of Rainfall","Leonardo","","0024-094X","","https://www.jstor.org/stable/41550653","The Rainwire project forms part of an art/science initiative to investigate environmental sonifícation of land-based natural rainfall using large-scale long wire instruments.","2012","2023-07-10 07:05:16","2023-07-10 07:05:16","2023-07-10 07:05:06","288-289","","3","45","","","Rainwire","","","","","","","","","","","","JSTOR","","Publisher: The MIT Press","","/Users/minsik/Zotero/storage/SZD2JABL/Burraston - 2012 - Rainwire Environmental Sonification of Rainfall.pdf","","","","","","","","","","","","","","","","","","","","","","","","","","","","","","","","","","","","","","","","","","","","","","","","",""
"93TWCC3X","journalArticle","2001","Root-Bernstein, Robert S.","Music, Creativity and Scientific Thinking","Leonardo","","0024-094X","","https://www.jstor.org/stable/1576986","Are music and science different types of intelligence (as posited in the context of Howard Gardner's multiple intelligences), or are they two manifestations of common ways of thinking? By focusing on scientists who have been musicians and on the ways they have used their musical knowledge to inform their scientific work, the author argues in this article that music and science are two ways of using a common set of ""tools for thinking"" that unify all disciplines. He explores the notion that creative individuals are usually polymaths who think in trans-disciplinary ways.","2001","2023-07-10 07:05:16","2023-07-10 07:05:16","2023-07-10 07:05:06","63-68","","1","34","","","","","","","","","","","","","","","JSTOR","","Publisher: [Leonardo, MIT Press]","","/Users/minsik/Zotero/storage/2IB9BQ8A/Root-Bernstein - 2001 - Music, Creativity and Scientific Thinking.pdf","","","","","","","","","","","","","","","","","","","","","","","","","","","","","","","","","","","","","","","","","","","","","","","","",""
"P5CWV2BZ","journalArticle","2005","Polli, Andrea","""Atmospherics/Weather Works"": A Spatialized Meteorological Data Sonification Project","Leonardo","","0024-094X","","https://www.jstor.org/stable/1577642","""Atmospherics/Weather Works"" is a performance, installation and distributed software project for the sonification of storms and other meteorological events, generated directly from data produced by a highly detailed and physically accurate simulation of the weather.","2005","2023-07-10 07:05:16","2023-07-10 07:05:16","2023-07-10 07:05:07","31-36","","1","38","","","""Atmospherics/Weather Works""","","","","","","","","","","","","JSTOR","","Publisher: [Leonardo, The MIT Press]","","","","","","","","","","","","","","","","","","","","","","","","","","","","","","","","","","","","","","","","","","","","","","","","","","",""
"MHCZZZPL","journalArticle","2007","Shi, X. J.; Cai, Y. Y.; Chan, C. W.","Electronic Music for Bio-Molecules Using Short Music Phrases","Leonardo","","0024-094X","","https://www.jstor.org/stable/20206375","The authors explore protein sonification issues using Morse code theory. Short musical phrases based on protein amino acids are used to compose protein music. Rhythms and tunes familiar to teenagers are also investigated, with the aim of producing different genres of protein music. A special musical instrument, the Chinese guzheng, can be employed to play the protein music. Experiment is carried out with different proteins, including the HIV main protease. It is hoped that this study can help unveil the mysteries of nature and motivate students to learn biology.","2007","2023-07-10 07:05:16","2023-07-10 07:05:16","2023-07-10 07:05:07","137-141","","2","40","","","","","","","","","","","","","","","JSTOR","","Publisher: The MIT Press","","","","","","","","","","","","","","","","","","","","","","","","","","","","","","","","","","","","","","","","","","","","","","","","","","",""
"XILKRACG","journalArticle","2013","Jensenius, Alexander Refsum","Some Video Abstraction Techniques for Displaying Body Movement in Analysis and Performance","Leonardo","","0024-094X","","https://www.jstor.org/stable/23468117","This paper presents an overview of techniques for creating visual displays of human body movement based on video recordings. First a review of early movement and video visualization techniques is given. Then follows an overview of techniques that the author has developed and used in the study of music-related body movements: motion history images, motion average images, motion history keyframe images and motiongrams. Finally, examples are given of how such visualization techniques have been used in empirical music research, in medical research and for creative applications.","2013","2023-07-10 07:05:16","2023-07-10 07:05:16","2023-07-10 07:05:08","53-43","","1","46","","","","","","","","","","","","","","","JSTOR","","Publisher: The MIT Press","","","","","","","","","","","","","","","","","","","","","","","","","","","","","","","","","","","","","","","","","","","","","","","","","","",""
"S7RS9UDS","journalArticle","2015","Harris, Yolande","Scorescapes: On Sound, Environment and Sonic Consciousness","Leonardo","","0024-094X","","https://www.jstor.org/stable/43835212","The author discusses Scorescapes, an artistic research project that investigates how sound mediates our relationship to the environment and how contemporary multidisciplinary art practices can articulate this. Scorescapes joins the author's own artistic practice with a theoretical analysis that highlights how relationships to the environment drawn through sound are profoundly bound up with technology. Key concepts include: making the inaudible audible; underwater sound and cetacean communication; field recordings and the contextual basis of sound; typologies of listening; the score as relationship; and techno-intuition.","2015","2023-07-10 07:05:16","2023-07-10 07:05:16","2023-07-10 07:05:08","117-123","","2","48","","","Scorescapes","","","","","","","","","","","","JSTOR","","Publisher: [Leonardo, The MIT Press]","","","","","","","","","","","","","","","","","","","","","","","","","","","","","","","","","","","","","","","","","","","","","","","","","","",""
"MRDA2FR9","journalArticle","2004","Ballora, Mark; Pennycook, Bruce; Ivanov, Plamen C.; Glass, Leon; Goldberger, Ary L.","Heart Rate Sonification: A New Approach to Medical Diagnosis","Leonardo","","0024-094X","","https://www.jstor.org/stable/1577570","Ever since 1819, when Theophile Laënnec first put a block of wood to a patient's chest in order to listen to her heartbeat, physicians have used auscultation to help diagnose cardiopulmonary disorders. Here the authors describe a novel diagnostic method based in music technology. Digital musicsynthesis software is used to transform the sequence of time intervals between consecutive heartbeats into an electroacoustic soundtrack. The results show promise as a diagnostic tool and also provide the basis of an interesting musical soundscape.","2004","2023-07-10 07:05:16","2023-07-10 07:05:16","2023-07-10 07:05:09","41-46","","1","37","","","Heart Rate Sonification","","","","","","","","","","","","JSTOR","","Publisher: The MIT Press","","","","","","","","","","","","","","","","","","","","","","","","","","","","","","","","","","","","","","","","","","","","","","","","","","",""
"KISUNS3T","journalArticle","2013","Kirke, Alexis; Miranda, Eduardo; Chiaramonte, Antonino; Troisi, Anna R.; Matthias, John; Fry, Nicholas; McCabe, Catherine","Cloud Chamber: A Performance with Real Time Two-Way Interaction between Subatomic Particles and Violinist","Leonardo","","0024-094X","","https://www.jstor.org/stable/23468125","'Cloud Chamber' - a composition by Alexis Kirke, Antonino Chiaramonte, and Anna Troisi - is a live performance in which the invisible quantum world becomes visible as a violinist and subatomic particle tracks interact together. An electronic instrument was developed which can be ""played"" live by radioactive atomic particles. Electronic circuitry was developed enabling a violin to create a physical force field that directly affects the ions generated by cosmic radiation particles. This enabled the violinist and the ions to influence each other musically in real time. A glass cloud chamber was used onstage to make radioactivity visible in bright white tracks moving within, with the tracks projected onto a large screen.","2013","2023-07-10 07:05:16","2023-07-10 07:05:16","2023-07-10 07:05:10","84-85","","1","46","","","Cloud Chamber","","","","","","","","","","","","JSTOR","","Publisher: The MIT Press","","","","","","","","","","","","","","","","","","","","","","","","","","","","","","","","","","","","","","","","","","","","","","","","","","",""
"L5F9TTLZ","journalArticle","2016","Eloul, Shaltiel; Zissu, Gil; Amo, Yehiel H.; Jacoby, Nori","Motion Tracking of a Fish as a Novel Way to Control Music Performance","Leonardo","","0024-094X","","https://www.jstor.org/stable/43834350","The authors have mapped the three-dimensional motion of a fish onto various electronic music performance gestures, including loops, melodies, arpeggio and DJ-like interventions. They combine an element of visualization, using an LED screen installed on the back of an aquarium, to create a link between the fish's motion and the sonified music. This visual addition provides extra information about the fish's role in the music, enabling the perception of versatile and developing auditory structures during the performance that extend beyond the sonification of the momentary motion of objects.","2016","2023-07-10 07:05:16","2023-07-10 07:05:16","2023-07-10 07:05:10","203-210","","3","49","","","","","","","","","","","","","","","JSTOR","","Publisher: [Leonardo, The MIT Press]","","","","","","","","","","","","","","","","","","","","","","","","","","","","","","","","","","","","","","","","","","","","","","","","","","",""
"6IV4K9DK","journalArticle","2005","Miranda, Eduardo Reck; Brouse, Andrew","Interfacing the Brain Directly with Musical Systems: On Developing Systems for Making Music with Brain Signals","Leonardo","","0024-094X","","https://www.jstor.org/stable/20206079","The authors discuss their work on developing technology to interface the brain directly with music systems, a field of research generally known as Brain-Computer Interfacing (BCI). The paper gives a brief background of BCI in general and surveys various attempts at musical BCI, or Brain-Computer Music Interface (BCMI)--systems designed to make music from brain signals, or brainwaves. The authors present a technical introduction to the electroencephalogram (EEG), which measures brainwaves detected by electrodes placed directly on the scalp. They introduce approaches to the design of BCI and BCMI systems and present two case study systems of their own design: the BCMI-Piano and the Inter-Harmonium.","2005","2023-07-10 07:05:16","2023-07-10 07:05:16","2023-07-10 07:05:11","331-336","","4","38","","","Interfacing the Brain Directly with Musical Systems","","","","","","","","","","","","JSTOR","","Publisher: [Leonardo, The MIT Press]","","","","","","","","","","","","","","","","","","","","","","","","","","","","","","","","","","","","","","","","","","","","","","","","","","",""
"78PUD7CJ","journalArticle","2016","Barrass, Stephen","An Annotated Portfolio of Research through Design in Acoustic Sonification","Leonardo","","0024-094X","","https://www.jstor.org/stable/43834326","The Hypertension Singing Bowl was shaped from a year of the author's blood pressure readings, and 3D printed in stainless steel so it would ring. This digitally fabricated singing bowl is an ""ultimate particular"" that establishes the design space of Acoustic Sonifications. This paper presents early experiments with Acoustic Sonification and analyses them using an Annotated Portfolio to identify interaction, perception, aesthetics and contemplation as important axes of the domain. This illustrates how Annotated Portfolios could also be used to analyse New Interfaces for Musical Expression.","2016","2023-07-10 07:05:16","2023-07-10 07:05:16","2023-07-10 07:05:11","72-73","","1","49","","","","","","","","","","","","","","","JSTOR","","Publisher: [Leonardo, The MIT Press]","","","","","","","","","","","","","","","","","","","","","","","","","","","","","","","","","","","","","","","","","","","","","","","","","","",""
"7WQ4SS47","journalArticle","2015","Kirke, Alexis; Eaton, Joel; Miranda, Eduardo","Real-Time Hallucination Simulation and Sonification through User-Led Development of an iPad Augmented Reality Performance","Leonardo","","0024-094X","","https://www.jstor.org/stable/43832993","The simulation of visual hallucinations has multiple applications. The authors present a new approach to hallucination simulation, initially developed for a performance, that proved to have uses for individuals suffering from certain types of hallucinations. The system, originally developed with a focus on the visual symptoms of palinopsia experienced by the lead author, allows real-time visual expression using augmented reality via an iPad. It also allows the hallucinations to be converted into sound through visuals sonification. Although no formal experimentation was conducted, the authors report on a number of unsolicited informal responses to the simulator from palinopsia sufferers and the Palinopsia Foundation.","2015","2023-07-10 07:05:16","2023-07-10 07:05:16","2023-07-10 07:05:12","235-242","","3","48","","","","","","","","","","","","","","","JSTOR","","Publisher: [Leonardo, The MIT Press]","","","","","","","","","","","","","","","","","","","","","","","","","","","","","","","","","","","","","","","","","","","","","","","","","","",""
"5J74HA2H","journalArticle","2014","Gresham-Lancaster, Scot","Computer Music Network","Leonardo","","0024-094X","","https://www.jstor.org/stable/43834187","The social climate and cultural atmosphere of the San Francisco Bay Area in the late 70's early 80's plus the emergence of the nascent microcomputer industry made for a social network and approach that fostered the creation of a new type of collaborative electronic music ensemble with techniques that have come to be known as ""Computer Music Network"". A transformation from initial heterogeneous to a more homogeneous underlying paradigm has brought with it aesthetic questions about the reason and evolution of this new genre.","2014","2023-07-10 07:05:16","2023-07-10 07:05:16","2023-07-10 07:05:12","266-267","","3","47","","","","","","","","","","","","","","","JSTOR","","Publisher: [Leonardo, The MIT Press]","","","","","","","","","","","","","","","","","","","","","","","","","","","","","","","","","","","","","","","","","","","","","","","","","","",""
"J3A6MIKV","journalArticle","2014","Gingrich, Oliver; Renaud, Alain; Emets, Eugenia; Xiao, Zhidong","Transmission: A Telepresence Interface for Neural and Kinetic Interaction","Leonardo","","0024-094X","","https://www.jstor.org/stable/43834227","Transmission is both a telepresence performance and a research project. As a real-time visualization tool, Transmission creates alternate representations of neural activity through sound and vision, investigating the effect of interaction on human consciousness. As a sonification project, it creates an immersive experience for two users: a soundscape created by the human mind and the influence of kinetic interaction. An electroencephalographic (EEG) headset interprets a user's neural activity. An Open Sound Control (OSC) script then translates this data into a real-time particle stream and sound environment at one end. A second user in a remote location modifies this stream in real time through body movement. Together they become a telematic musical interface—communicating through visual and sonic representation of their interactions.","2014","2023-07-10 07:05:16","2023-07-10 07:05:16","2023-07-10 07:05:13","375-385","","4","47","","","Transmission","","","","","","","","","","","","JSTOR","","Publisher: [Leonardo, The MIT Press]","","","","","","","","","","","","","","","","","","","","","","","","","","","","","","","","","","","","","","","","","","","","","","","","","","",""
