"LLT2DTJ5","journalArticle","2009","Adderley, W. Paul; Young, Michael","Ground-Breaking: Scientific and Sonic Perceptions of Environmental Change in the African Sahel","Leonardo","","0024-094X","","https://www.jstor.org/stable/40540058","Soils surrounding ancient settlements can hold evidence of the activities of past societies. To seek an understanding of how past societies have reacted and contributed to environmental change requires many data sources. The realtime audiovisual installation Ground-breaking problematizes the presentation of such data, gained in this case through the image-analysis of soil materials. These data are used to connote environmental events and consequent human responses. By combining these data with audiovisual synthesis and environmental recordings, the authors present a basis for developing conceptualizations of new locales undergoing environmental change; the visual and sonic narratives that are developed allow the art-science interface to be explored.","2009","2023-07-10 07:05:16","2023-07-10 07:05:16","2023-07-10 07:05:15","404-395","","5","42","","","Ground-Breaking","","","","","","","","","","","","JSTOR","","Publisher: [Leonardo, The MIT Press]","","","","","","","","","","","","","","","","","","","","","","","","","","","","","","","","","","","","","","","","","","","","","","","","","","",""
"8F5649YP","journalArticle","2015","Forbes, Angus Graeme","Articulating Media Arts Activities in Art-Science Contexts","Leonardo","","0024-094X","","https://www.jstor.org/stable/43833033","This paper discusses the conflicting expectations for media artists taking part in art-science collaborations. Despite the increasing opportunity to participate in these interdisciplinary projects, it can be unclear how media arts activities are best articulated, or even if they need to be defined at all. Additionally, this paper examines a methodological framework widely used in the visualization community for identifying different visualization tasks within research activities. Inspired by its success, this paper proposes a new methodological framework for media arts activities in art-science contexts. This framework splits media arts activities into overlapping areas: generation, augmentation, provocation and mediation, providing a useful way to articulate the broader importance of media arts in interdisciplinary collaboration.","2015","2023-07-10 07:05:59","2023-07-10 07:05:59","2023-07-10 07:05:44","330-337","","4","48","","","","","","","","","","","","","","","JSTOR","","Publisher: [Leonardo, The MIT Press]","","","","","","","","","","","","","","","","","","","","","","","","","","","","","","","","","","","","","","","","","","","","","","","","","","",""
"43KDUPWK","journalArticle","2010","Roshto, Barry L.; Panouklia, Eleni; Holder, John; Pryor, Sally","Ephemeron — Sculpting a Collective Consciousness and Mapping a Collaborative Process","Leonardo","","0024-094X","","https://www.jstor.org/stable/40864243","Ephemeron is an interactive installation resulting from the collaboration of artists during the e-MobilArt project. Ephemeron, a responsive sculpture, attempts to express the eternal ephemeral human epic: the daily song of pain and struggle, love and loss, lived by beings full of ""mud and dreams"". The installation comprises an audio soundscape, projected video and a large fabric form under high tension and with a floor of sand. Visitors may enter the form, where the projected video and soundscape become sensitive to their presence.","2010","2023-07-10 07:05:59","2023-07-10 07:05:59","2023-07-10 07:05:55","496-497","","5","43","","","","","","","","","","","","","","","JSTOR","","Publisher: [Leonardo, MIT Press]","","","","","","","","","","","","","","","","","","","","","","","","","","","","","","","","","","","","","","","","","","","","","","","","","","",""
"2DQK5WP7","journalArticle","2006","Cai, Y. Y.; Lu, B. F.; Fan, Z. W.; Chan, C. W.; Lim, K. T.; Qi, L.; Li, L.","Proteins, Immersive Games and Music","Leonardo","","0024-094X","","https://www.jstor.org/stable/20206185","The authors present their research on using virtual reality (VR) in the presentation of protein music and immersive games. They first describe the core components of VR technology for protein modeling, visualization and interaction. They then present their implementations of VR protein games and protein-derived computer music. Instruction in protein-structure learning is discussed in the context of the authors' trial project in the Chinese High School in Singapore and an exhibition at Singapore Art Museum.","2006","2023-07-10 07:05:59","2023-07-10 07:05:59","2023-07-10 07:05:55","134-137","","2","39","","","","","","","","","","","","","","","JSTOR","","Publisher: The MIT Press","","","","","","","","","","","","","","","","","","","","","","","","","","","","","","","","","","","","","","","","","","","","","","","","","","",""
"AGRG6236","journalArticle","2016","Mills, Roger","Flight of the Sea Swallow: A Crossreality Telematic Performance","Leonardo","","0024-094X","","https://www.jstor.org/stable/43834325","Flight of the Sea Swallow is a cross-reality telematic performance project developed by the multimedia group blackhole-factory. Live data from distributed heat, light and movement sensors is visualised within the virtual and real-world performance spaces, with the aim of increasing tele-presence for performers and audiences. This article describes the background of the project, as well as its design and implementation over several iterative performances.","2016","2023-07-10 07:06:27","2023-07-10 07:06:27","2023-07-10 07:06:25","68-69","","1","49","","","Flight of the Sea Swallow","","","","","","","","","","","","JSTOR","","Publisher: [Leonardo, The MIT Press]","","","","","","","","","","","","","","","","","","","","","","","","","","","","","","","","","","","","","","","","","","","","","","","","","","",""
"EQK2WZPE","journalArticle","2016","Cetilia, Mark","""Pulse Shape 22"": Audiovisual Performance and Data Transmutation","Leonardo","","0024-094X","","https://www.jstor.org/stable/24916849","Pulse Shape 22 is an improvisational audiovisual performance featuring shortwave radio transmissions as the sole source material for real-time audio processing alongside video of the sun projected through cast-glass lenses designed specifically for this piece. The structure of the piece is derived from metrics on energy accumulation over a period of 2.2 nanoseconds resulting from the targeting of 60 laser beams on a single tetrahedral hohlraum in weapons testing experiments as carried out by the Los Alamos Inertial Confinement Fusion unit, at the Omega Laser Facility at the University of Rochester. Pulse Shape 22 is an exploration of architectural space through the use of site- and time-specific information found in regions of the electromagnetic spectrum outside the reaches of the human sensory apparatus. It is an attempt to alter the audience's perceptions of their surroundings and create a moment of rupture from hidden worlds found in our local environment.","2016","2023-07-10 07:06:27","2023-07-10 07:06:27","2023-07-10 07:06:26","317-323","","4","49","","","""Pulse Shape 22""","","","","","","","","","","","","JSTOR","","Publisher: [Leonardo, The MIT Press]","","","","","","","","","","","","","","","","","","","","","","","","","","","","","","","","","","","","","","","","","","","","","","","","","","",""
"G8TFDQK2","journalArticle","2011","Decamous, Gabrielle","Nuclear Activities and Modern Catastrophes: Art Faces the Radioactive Waves","Leonardo","","0024-094X","","https://www.jstor.org/stable/20869419","Nuclear-related artworks provide a favorable terrain for investigation of our contemporary epoch, for they relate to a science whose applications are highly political and that is spreading beyond the Western world. In times of global warming, indeed, the prospect of nuclear energy reappears as the latest sought-after modern technology. But after Hiroshima and Chernobyl, and given the dualistic civilian and military use of the atom, how do artists react to nuclear activities and their inherent politics? Can art provide an effective counter-practice to global nuclear politics? The author argues that art and science share the same project—the modernist project—and that art, like science, has to question its modern heritage.","2011","2023-07-10 07:06:48","2023-07-10 07:06:48","2023-07-10 07:06:41","125-140","","2","44","","","Nuclear Activities and Modern Catastrophes","","","","","","","","","","","","JSTOR","","Publisher: The MIT Press","","","","","","","","","","","","","","","","","","","","","","","","","","","","","","","","","","","","","","","","","","","","","","","","","","",""
"GLPLWAWH","journalArticle","2010","Simanowski, Roberto","Digital Anthropophagy: Refashioning Words as Image, Sound and Action","Leonardo","","0024-094X","","https://www.jstor.org/stable/40661622","This paper discusses the incorporation of text within interactive installations as an expression of cultural anthropophagy. This ""consumption"" is carried out not by displacing the text (i.e. replacing it with images) but by transforming text into image, sound or action, or into a postalphabetic object (i.e. depriving the text of its linguistic value). As shown in detailed examples, the de-semanticization of text turns words into ornament, while in other cases (where the linguistic value of the text is stressed within the interactive installation or can be ""rescued"" from it) the literary is still an important subject of attention.","2010","2023-07-10 07:06:48","2023-07-10 07:06:48","2023-07-10 07:06:41","159-123","","2","43","","","Digital Anthropophagy","","","","","","","","","","","","JSTOR","","Publisher: [Leonardo, The MIT Press]","","","","","","","","","","","","","","","","","","","","","","","","","","","","","","","","","","","","","","","","","","","","","","","","","","",""
"DTDKKTH2","journalArticle","2008","Johnston, Sean F.","A Cultural History of the Hologram","Leonardo","","0024-094X","","https://www.jstor.org/stable/20206585","The hologram, the novel imaging medium conceived in 1947, underwent a series of technical mutations over the following 50 years. Those successive adaptations altered the form of the medium, broadened its imaging capabilities and promoted wider perceptions of its functions and possibilities. Appropriated by disparate technical communities and presented to varied audiences, the hologram and its cultural meanings evolved dramatically. This paper relates the fluidity of the form, function and meaning of the hologram to its distinct creators and users.","2008","2023-07-10 07:06:48","2023-07-10 07:06:48","2023-07-10 07:06:42","223-221","","3","41","","","","","","","","","","","","","","","JSTOR","","Publisher: The MIT Press","","","","","","","","","","","","","","","","","","","","","","","","","","","","","","","","","","","","","","","","","","","","","","","","","","",""
"FQABKKJT","journalArticle","2011","Kuchera-Morin, JoAnn","Performing in Quantum Space: A Creative Approach to N-Dimensional Computing","Leonardo","","0024-094X","","https://www.jstor.org/stable/41421781","This paper discusses a new approach to scientific and artistic computing that allows one to use the creative process of music performance to interact with n-dimensional data sets. Using a unique multiuser instrument, the AlloSphere, a three-story metal sphere in an echo-free chamber that immerses approximately twenty-five researchers in 4-Pi stereo radians of interactive visual and audio data, new scientific discoveries and emergent art transform science and art into a new field.","2011","2023-07-10 07:06:48","2023-07-10 07:06:48","2023-07-10 07:06:43","462-463","","5","44","","","Performing in Quantum Space","","","","","","","","","","","","JSTOR","","Publisher: The MIT Press","","","","","","","","","","","","","","","","","","","","","","","","","","","","","","","","","","","","","","","","","","","","","","","","","","",""
"IXF7EH4P","journalArticle","2012","Taylor, Sean; Fernström, Mikael","Marbh Chrios","Leonardo","","0024-094X","","https://www.jstor.org/stable/41550776","Marbh Crhios (Dead Zone) is a multimedia artwork, part of the Lovely Weather Donegal Residencies Project, that reflects upon climate change in the context of a local community in Killybegs in County Donegal, Ireland. The work was based on scientific data about contested marine 'dead zones' that the authors represented with algorithmically generated music, sonifications and visualizations in a live performance in Mooney's Boatyard in Killybegs, involving three local ensembles.","2012","2023-07-10 07:06:48","2023-07-10 07:06:48","2023-07-10 07:06:44","192-193","","2","45","","","","","","","","","","","","","","","JSTOR","","Publisher: The MIT Press","","","","","","","","","","","","","","","","","","","","","","","","","","","","","","","","","","","","","","","","","","","","","","","","","","",""
"K4RRQFZI","journalArticle","2008","Middleton, Jonathan N.; Dowd, Diane","Web-Based Algorithmic Composition from Extramusical Resources","Leonardo","","0024-094X","","https://www.jstor.org/stable/20206553","The authors, a composer and a mathematician, demonstrate how the Web-based application ""musicalgorithms"" translates numbers into musical events. Details of the algorithmic process and the decisions behind mathematical scaling operations are presented in two compositions called ""Redwoods Symphony"" and ""Dreaming among Thermal Pools and Concentric Spirals"".","2008","2023-07-10 07:06:48","2023-07-10 07:06:48","2023-07-10 07:06:45","118-135","","2","41","","","","","","","","","","","","","","","JSTOR","","Publisher: The MIT Press","","","","","","","","","","","","","","","","","","","","","","","","","","","","","","","","","","","","","","","","","","","","","","","","","","",""
"H5RR7YT9","journalArticle","1992","Evans, Brian","Number as Form and Content: A Composer's Path of Inquiry","Leonardo","","0024-094X","10.2307/1575855","https://www.jstor.org/stable/1575855","The traditions of absolute music provide a foundation for today's composer. In the twentieth century these traditions have been stretched to a breaking point, opening new avenues of artistic exploration. The author here explores the grammatical tool of visual consonance, using mathematics as a mechanism for the generation and composition of abstract materials. The idea of form and content as inseparable aspects of Western musical practice is applied to visual art. The golden section is used as a continuous thread throughout the discussion, and several works are analyzed. Also included are a historical survey and a sampling of the author's work.","1992","2023-07-10 07:06:48","2023-07-10 07:06:48","2023-07-10 07:06:46","303-311","","3/4","25","","","Number as Form and Content","","","","","","","","","","","","JSTOR","","Publisher: The MIT Press","","","","","","","","","","","","","","","","","","","","","","","","","","","","","","","","","","","","","","","","","","","","","","","","","","",""
"Y7NTJYZG","journalArticle","2013","Bertacchini, Francesca; Bilotta, Eleonora; Gabriele, Lorella; Pantano, Pietro; Tavernise, Assunta","Toward the Use of Chua's Circuit in Education, Art and Interdisciplinary Research: Some Implementation and Opportunities","Leonardo","","0024-094X","","https://www.jstor.org/stable/43834077","This paper considers the merging of Chaos with art, including such forms as digital images, sounds and music, based on dynamic systems derived from Chua's Circuit and using appropriate coding methods. Design elements, logos, musical instruments, software environments, multimedia theater performances and virtual museums with strange attractors have also been realized. In the field of education, the paper introduces environments that have foreseen the virtual manipulation of patterns derived from Chua's Circuit, which has fostered a deeper understanding of the evolution of dynamic systems through computer simulation.","2013","2023-07-10 07:06:48","2023-07-10 07:06:48","2023-07-10 07:06:46","456-463","","5","46","","","Toward the Use of Chua's Circuit in Education, Art and Interdisciplinary Research","","","","","","","","","","","","JSTOR","","Publisher: [Leonardo, The MIT Press]","","","","","","","","","","","","","","","","","","","","","","","","","","","","","","","","","","","","","","","","","","","","","","","","","","",""
"S7FDCZFR","journalArticle","2012","Ge, Dongya; Li, Yixue","Songs of Genes, by Genes, for Genes","Leonardo","","0024-094X","","https://www.jstor.org/stable/41421815","The authors have defined a new concept of ""base_position"" and translated the protein-coding sequence to a sequence consisting of 12 base_positions. The authors developed a new algorithm for translating the base_position sequence to a melody with a range of at most a twelfth and without leaps larger than an octave, which should be turned upside-down by a step or small skip after a big leap and was used as the musical theme. The lyric was written according to the summary of the gene. The authors propose a new action of expressing respect to genes by creating songs of genes, by genes, for genes.","2012","2023-07-10 07:06:48","2023-07-10 07:06:48","2023-07-10 07:06:46","96-97","","1","45","","","","","","","","","","","","","","","JSTOR","","Publisher: The MIT Press","","","","","","","","","","","","","","","","","","","","","","","","","","","","","","","","","","","","","","","","","","","","","","","","","","",""
"VLYZVKQ2","journalArticle","2012","Davis, Tom","Complexity as Practice: A Reflection on the Creative Outcomes of a Sustained Engagement with Complexity","Leonardo","","0024-094X","","https://www.jstor.org/stable/41550748","This article presents a reflection on a body of creative work carried out during four years of Ph. D. research that explored the relationship between complexity theory and music. The article highlights conceptual problems that arose during the creation of the work, especially those associated with the exploration of scientific models for the creation of art. The author does not attempt to offer any final solutions but rather presents the journey undertaken through the combined artistic and research practice as a way of documenting the strategies he developed during this period of creative practice.","2012","2023-07-10 07:06:48","2023-07-10 07:06:48","2023-07-10 07:06:47","106-120","","2","45","","","Complexity as Practice","","","","","","","","","","","","JSTOR","","Publisher: The MIT Press","","","","","","","","","","","","","","","","","","","","","","","","","","","","","","","","","","","","","","","","","","","","","","","","","","",""
"JC2ZDC8H","journalArticle","2016","Mast, Sara; Jellison, Jessica; O'Leary, Christopher; Bolte, Jason; Stillwell, Cindy; Kankelborg, Charles; Yunes, Nicolás; Key, Joey Shapiro; Raley, Jessica","Black (W)hole: An Artscience and Education Collaboration","Leonardo","","0024-094X","","https://www.jstor.org/stable/43834318","Black (W)hole is an immersive art installation created collaboratively by artists and scientists utilizing data visualization of an extreme mass ratio inspirai (EAARI) and the sonification of its emitted gravitational waves in an experiential work of ""artscience"" and science education. The sensory-rich environment of the installation engages mind and body, expanding and enriching the participant's capacity to imagine and wonder about the beauty and meaning of this highly abstract astronomical object, the black hole. The work investigates both historical and current gravitational wave astronomy, illustrating our 21 st-century understanding of the cosmos.","2016","2023-07-10 07:06:48","2023-07-10 07:06:48","2023-07-10 07:06:47","19-34","","1","49","","","Black (W)hole","","","","","","","","","","","","JSTOR","","Publisher: [Leonardo, The MIT Press]","","","","","","","","","","","","","","","","","","","","","","","","","","","","","","","","","","","","","","","","","","","","","","","","","","",""
"3K54IL34","journalArticle","2016","Janney, Eathan; Muñoz-Matutano, Guillermo","Interactive Musical Display of Quantum Dot Emission Spectra","Leonardo","","0024-094X","","https://www.jstor.org/stable/24916803","Quantum dots (QDs) are zero-dimensional semiconductor nanostructures composed of thousands of atoms. QDs are often referred to as artificial atoms because their small structure results in unique, atom-like behavior; like atoms, QDs have optical emission at discrete wavelengths. Here the authors describe a novel method to interactively learn about the spectral properties of QDs using musical intuitions. They transform spectral information from selected Indum Arsenide (InAs) QDs into musical information, including both pitch and rhythm. Thus, they generate a multisensory experience of spectral information allowing users to learn about the range of frequencies of QDs as well as their unique spectral properties resulting from coulombic interactions.","2016","2023-07-10 07:06:48","2023-07-10 07:06:48","2023-07-10 07:06:48","440-441","","5","49","","","","","","","","","","","","","","","JSTOR","","Publisher: [Leonardo, The MIT Press]","","","","","","","","","","","","","","","","","","","","","","","","","","","","","","","","","","","","","","","","","","","","","","","","","","",""
"IFWMQKJW","journalArticle","2016","Barrett, Natasha","Interactive Spatial Sonification of Multidimensional Data for Composition and Auditory Display","Computer Music Journal","","0148-9267","","https://www.jstor.org/stable/43829321","This article presents a new approach to interactive spatial sonification of multidimensional data as a tool for spatial sound synthesis, for composing temporal-spatial musical materials, and as an auditory display for scientists to analyze multidimensional data sets in time and space. The approach applies parameter-mapping sonification and is currently implemented in an application called Cheddar, which was programmed in Max/MSP. Cheddar sonifies data in real time, where the user can modify a wide variety of temporal, spatial, and sonic parameters during the listening process, and thus more easily uncover patterns and processes in the data than when applying non-real-time, noninteractive techniques. The design draws on existing literature concerning perception and acoustics, and it applies the author's practical experience in acousmatic composition, spectromorphology, and sound semantics, while addressing accuracy, flexibility, and ease of use. Although previous sonification applications have addressed some degree of real-time control and spatialization, this approach integrates space and sound in an interactive framework. Spatial information is sonified in high-order 3-D ambisonics, where the user can interactively move the virtual listening position to reveal details easily missed from fixed or noninteractive spatial views. Sounds used as input to the sonification take advantage of the rich spectra and extramusical attributes of acoustic sources, which, although previously theorized, are investigated here in a practical context thoroughly tested alongside acoustic and psychoacoustic considerations. Furthermore, when using Cheddar, no specialized knowledge of programming, acoustics, or psychoacoustics is required. These approaches position Cheddar at the junction between science and art. With one application serving both disciplines, the patterns and processes of science are more fluently appropriated into music or sound art, and vice versa for scientific research, science public outreach, and education.","2016","2023-07-10 07:08:48","2023-07-10 07:08:48","2023-07-10 07:08:37","47-69","","2","40","","","","","","","","","","","","","","","JSTOR","","Publisher: The MIT Press","","/Users/minsik/Zotero/storage/QTHBI4JW/Barrett - 2016 - Interactive Spatial Sonification of Multidimension.pdf","","","","","","","","","","","","","","","","","","","","","","","","","","","","","","","","","","","","","","","","","","","","","","","","",""
"WSKGJJSV","journalArticle","2015","Kirke, Alexis; Freeman, Samuel; Miranda, Eduardo Reck","Wireless Interactive Sonification of Large Water Waves to Demonstrate the Facilities of a Large-Scale Research Wave Tank","Computer Music Journal","","0148-9267","","https://www.jstor.org/stable/43829278","Interactive sonification can provide a platform for demonstration and education as well as for monitoring and investigation. We present a system designed to demonstrate the facilities of the UK's most advanced large-scale research wave tank. The interactive sonification of water waves in the ""ocean basin"" wave tank at Plymouth University consisted of a number of elements: generation of ocean waves, acquisition and sonification of ocean-wave measurement data, and gesture-controlled pitch and amplitude of sonifications. The generated water waves were linked in real time to sonic features via depth monitors and motion tracking of a floating buoy. Types of water-wave patterns, varying in shape and size, were selected and triggered using wireless motion detectors attached to the demonstrator's arms. The system was implemented on a network of five computers utilizing Max/MSP alongside specialist marine research software, and was demonstrated live in a public performance for the formal opening of the Marine Institute building.","2015","2023-07-10 07:08:48","2023-07-10 07:08:48","2023-07-10 07:08:38","59-70","","3","39","","","","","","","","","","","","","","","JSTOR","","Publisher: The MIT Press","","","","","","","","","","","","","","","","","","","","","","","","","","","","","","","","","","","","","","","","","","","","","","","","","","",""
